Deal Number;Target Country;Target Region;Investor 1;Investor 2;Investor 3;Investor Country 1;Investor Country 2;Investor Country 3;Investor Region 1;Investor Region 2;Investor Region 3;Inv. Sector 1;Inv. Sector 2;Inv. Sector 3;Crop 1;Crop 2;Crop 3;Year;Hectares
17;Cambodia;South-East Asia;Angkor Sugar Co. Ltd.;Mitr Phol Group;;Cambodia;Thailand;;South-East Asia;South-East Asia;;Private;Private;;;;;;6523.0
19;Cambodia;South-East Asia;Bigi Mexico Sothy Aphivath Co Ltd;Bigimexco;;Cambodia;Vietnam;;South-East Asia;South-East Asia;;Private;Private;;Rubber;Cashew;;;10603.0
20;Cambodia;South-East Asia;BNA (Cam) Corp;;;Republic of Korea;;;;;;Private;;;Rubber;Cassava;;;7500.0
23;Cambodia;South-East Asia;CJ Cambodia Co Ltd;CJ Corporation;;Cambodia;Republic of Korea;;South-East Asia;;;Private;Private;;Cassava;Banana;Mango;;8000.0
27;Cambodia;South-East Asia;Carmadeno Venture (Cambodia) Limited;Carmadeno Venture Limited;;Cambodia;India;;South-East Asia;Southern Asia;;Private;Unknown;;;;;;7635.0
29;Cambodia;South-East Asia;Central First Company Limited;Central First Company;;Cambodia;United States of America;;South-East Asia;;;Private;Unknown;;Rubber;;;;7000.0
33;Cambodia;South-East Asia;Unknown (CIV Development Company);CIV Development Company;;Cambodia;Vietnam;;South-East Asia;South-East Asia;;Private;Private;;Rubber;Cassava;;;769.0
35;Cambodia;South-East Asia;Crops & Land Development (Cambodia) Co. Ltd;China Asean Resources Ltd.;;Cambodia;China, Hong Kong Special Administrative Region;;South-East Asia;;;Private;Private;;Rubber;;;;7200.0
36;Cambodia;South-East Asia;Danam Farms LTD in Cambodia;DUI Holding A/S;;Cambodia;Denmark;;South-East Asia;Northern Europe;;Private;Private;;Rubber;;;;4000.0
37;Cambodia;South-East Asia;Dau Tu Saigon-Binh Phouc (SBK);;;Vietnam;;;South-East Asia;;;Private;;;Rubber;Cassava;Cashew;;6436.0
39;Cambodia;South-East Asia;Unknown (Fortuna Plantation (Cambodia) Limited);Fortuna Plantation (Cambodia) Limited;;Cambodia;Malaysia;;South-East Asia;South-East Asia;;Private;Unknown;;Corn;Maize;Jatropha;;7955.0
40;Cambodia;South-East Asia;Unknown (CityStar);CityStar;;Cambodia;France;;South-East Asia;Western Europe;;Private;Private;;;;;;333.0
42;Cambodia;South-East Asia;GG World Group (Cambodia) Development Co., Ltd;Unknown (#158538);;Cambodia;Canada;;South-East Asia;Northern America;;Private;Unknown;;Cashew;Teak;;;4821.0
43;Cambodia;South-East Asia;Global Agricultural Development (Cambodia) Limited;Unknown;;Cambodia;United States of America;;South-East Asia;;;Private;Unknown;;Teak;;;;9800.0
48;Cambodia;South-East Asia;Grand Land Agricultural Development (Cambodia) Co Ltd;;;Cambodia;;;South-East Asia;;;Private;;;Teak;;;;9854.0
49;Cambodia;South-East Asia;Grandis Timber Ltd;SRP International Group Ltd.;International Woodlands Company A/S;Cambodia;China, Hong Kong Special Administrative Region;Denmark;South-East Asia;;Northern Europe;Private;Private;Private;Teak;;;;9603.0
50;Cambodia;South-East Asia;Great Asset Agricultural Development (Cambodia) Co Ltd;Unknown (#158540);;Cambodia;China;;South-East Asia;Eastern Asia;;Private;Unknown;;Cashew;;;;6928.0
51;Cambodia;South-East Asia;Great Wonder Agricultural Development (Cambodia) Limited;Unknown (#158502);;Cambodia;China;;South-East Asia;Eastern Asia;;Private;Unknown;;Rubber;Cashew;;;8178.0
55;Cambodia;South-East Asia;Unknown (HBC INVESTMENT AND SERVICES JOINT STOCK COMPANY, in Cambodia, 34833);Hoa Binh Construction (HBC) Group JSC;;Cambodia;Vietnam;;South-East Asia;South-East Asia;;Private;Private;;Eucalyptus;;;;5914.0
57;Cambodia;South-East Asia;Heng Brothers Co Ltd;Hoang Anh Gia Lai Joint Stock Company (HAGL Group);;Cambodia;Vietnam;;South-East Asia;South-East Asia;;Private;Private;;Rubber;;;;2361.0
67;Cambodia;South-East Asia;Koh Kong Plantation Company Limited;Khon Kaen Sugar Industry Public Company Limited;;Cambodia;Thailand;;South-East Asia;South-East Asia;;Private;Private;;;;;;9400.0
68;Cambodia;South-East Asia;Koh Kong Sugar Company Ltd;Khon Kaen Sugar Industry Public Company Limited;;Cambodia;Thailand;;South-East Asia;South-East Asia;;Private;Private;;;;;;9700.0
70;Cambodia;South-East Asia;Land and Developing (Cambodia);Unknown (#158515);;Cambodia;China;;South-East Asia;Eastern Asia;;Private;Unknown;;Rubber;Cashew;;;7000.0
73;Cambodia;South-East Asia;Cane and Sugar Valley;Mitr Phol Group;;Cambodia;Thailand;;South-East Asia;South-East Asia;;Private;Private;;;;;;6595.0
75;Cambodia;South-East Asia;Mega Star Investment and Forestry Development;Unknown (#158291);;Cambodia;Vietnam;;South-East Asia;South-East Asia;;Private;Unknown;;Rubber;;;;8000.0
77;Cambodia;South-East Asia;Hong An Mang Yang K Rubber Development;Vietnam Rubber Group;;Cambodia;Vietnam;;South-East Asia;South-East Asia;;Private;Government;;Rubber;;;;6101.95
79;Cambodia;South-East Asia;Mondul Agri-Resource Co., Ltd;Unknown (#158402);;Cambodia;Singapore;;South-East Asia;South-East Asia;;Private;Private;;Rubber;;;;9100.0
82;Cambodia;South-East Asia;Hoang Anh Oyadav Co. Ltd.;Hoang Anh Gia Lai Joint Stock Company (HAGL Group);;Cambodia;Vietnam;;South-East Asia;South-East Asia;;Private;Private;;Rubber;;;;6866.0
83;Cambodia;South-East Asia;PDA (Cambodia) Co. Ltd.;;;Korea, Dem. People's Rep.;;;;;;Private;;;Rubber;Cassava;;;5256.0
95;Cambodia;South-East Asia;Tonle Sugar Cane Co Ltd;Mitr Phol Group;;Cambodia;Thailand;;South-East Asia;South-East Asia;;Private;Private;;;;;;6618.0
100;Cambodia;South-East Asia;HLH Agriculture (Cambodia) Co. Ltd.;HLH Group Limited;;Cambodia;Singapore;;South-East Asia;South-East Asia;;Private;Private;;Corn;Maize;;;9985.0
101;Cambodia;South-East Asia;Siv Guek Investment Co Ltd;HuaYue Group Co. Ltd.;;Cambodia;China;;South-East Asia;Eastern Asia;;Private;Private;;Rubber;Teak;;;9411.0
105;Cambodia;South-East Asia;Ta Bien Kampong Thom Rubber Development;Vietnam Rubber Group;;Cambodia;Vietnam;;South-East Asia;South-East Asia;;Private;Government;;Rubber;;;;8100.0
108;Cambodia;South-East Asia;Thy Nga Development and Investment Co. Ltd.;Vietnam Rubber Group;;Cambodia;Vietnam;;South-East Asia;South-East Asia;;Private;Government;;Rubber;;;;6060.0
109;Cambodia;South-East Asia;(Cambodia) Tong Min Group Engineering Co., Ltd.;China Asean Resources Ltd.;;Cambodia;China, Hong Kong Special Administrative Region;;South-East Asia;;;Private;Private;;Rubber;Jatropha;;;6971.0
112;Cambodia;South-East Asia;Unigreen Resource Co. Ltd.;Unigreen Resource Co., Ltd;;Cambodia;Malaysia;;South-East Asia;South-East Asia;;Private;Private;;Rubber;;;;8000.0
117;Cambodia;South-East Asia;Unknown (Wuzhishan L.S Group);Wuzhishan L.S Group;;Cambodia;China;;South-East Asia;Eastern Asia;;Private;Private;;Pine;;;;10000.0
129;Cambodia;South-East Asia;Unknown (Real Green Co. Ltd., in Cambodia, 34905);Real Green Co. Ltd.;;Cambodia;Thailand;;South-East Asia;South-East Asia;;Private;Private;;Cassava;;;;8000.0
130;Cambodia;South-East Asia;Dong Nai Kratie Aphivath Caoutchouc Co. Ltd.;Vietnam Rubber Group;;Cambodia;Vietnam;;South-East Asia;South-East Asia;;Private;Government;;Rubber;;;;2502.0
131;China;Eastern Asia;Yunnan Shenyu New Energy Co. Ltd.;China Sandi Holdings Limited;;China;China, Hong Kong Special Administrative Region;;Eastern Asia;;;Private;Private;;Jatropha;;;;33350.0
144;China;Eastern Asia;Stora Enso (Guangxi) Forestry Co Ltd;Stora Enso;;China;Finland;;Eastern Asia;Northern Europe;;Private;Private;;Eucalyptus;;;;90200.0
182;Indonesia;South-East Asia;Minamas Plantation;Sime Darby;;Indonesia;Malaysia;;South-East Asia;South-East Asia;;Private;Private;;;;;;59721.0
187;Indonesia;South-East Asia;Unknown (First Resources );First Resources;;Indonesia;Singapore;;South-East Asia;South-East Asia;;Private;Private;;Rubber;;;;100000.0
191;Indonesia;South-East Asia;Unknown operating company (#38084);First Pacific;;Indonesia;China, Hong Kong Special Administrative Region;;South-East Asia;;;Private;Private;;Rubber;;;;380172.0
195;Indonesia;South-East Asia;PT. Henrison Inti Persada (IDN);Noble Group;;Indonesia;China, Hong Kong Special Administrative Region;;South-East Asia;;;Private;Private;;;;;;32500.0
217;Lao PDR;;Birla Lao Pulp & Plantations Company Limited;Shandong Sun Paper;;Lao PDR;China;;;Eastern Asia;;Private;Private;;Eucalyptus;;;;50000.0
219;Lao PDR;;Ari Construction and Building Repairment Co;;;China;;;Eastern Asia;;;Private;;;Rubber;;;;200.0
222;Lao PDR;;Cherchanghang Co;;;China;;;Eastern Asia;;;Unknown;;;Rubber;;;;200.0
230;Lao PDR;;GO Crapkin Co Ltd;;;Republic of Korea;;;;;;Unknown;;;;;;;500.0
234;Lao PDR;;Hoang Anh Attapeu Agriculture Development Co. Ltd.;Hoang Anh Gia Lai Joint Stock Company (HAGL Group);;Lao PDR;Vietnam;;;South-East Asia;;Private;Private;;Rubber;;;;20000.0
238;Lao PDR;;Kolao Farm and Bio Energy Company;Koala Group;;Lao PDR;Vietnam;;;South-East Asia;;Private;Private;;Jatropha;;;;14507.0
251;Lao PDR;;Unknown (Kaosouyaotiang Viet-Lao Company);Kaosouyaotiang Viet-Lao Company;;Lao PDR;Vietnam;;;South-East Asia;;Private;Unknown;;Rubber;;;;10000.0
253;Lao PDR;;Savannakhet Sugar Corporation (SSC);Khon Kaen Sugar Industry Public Company Limited;;Lao PDR;Thailand;;;South-East Asia;;Private;Private;;;;;;10000.0
254;Lao PDR;;Unknown (KV Import-Export Co. Ltd.);KV Import-Export Co. Ltd.;;Lao PDR;Malaysia;;;South-East Asia;;Private;Unknown;;Jatropha;;;;500.0
261;Lao PDR;;Lao-Thai Hua Rubber Company;Honda;;Lao PDR;Japan;;;Eastern Asia;;Private;Government;;Rubber;;;;16000.0
266;Lao PDR;;Unknown (Yunnan Lilieng Biological Co. Ltd.);Yunnan Power Biological Products Co. Ltd;;Lao PDR;China;;;Eastern Asia;;Private;Private;;Rubber;;;;500.0
268;Lao PDR;;Mitr Lao Sugar Company;Mitr Phol Group;;Lao PDR;Thailand;;;South-East Asia;;Private;Private;;;;;;10000.0
272;Lao PDR;;Mekong Timber Plantations Co, Ltd.;Government of Laos;;Lao PDR;Lao PDR;;;;;Private;Government;;Eucalyptus;;;;24000.0
274;Lao PDR;;Paksong Highland Company Limited;Thai Charoen Corporation Group (TCC);;Lao PDR;Thailand;;;South-East Asia;;Private;Private;;Coffee;;;;2400.0
277;Lao PDR;;Tongtheun Lao-China Agriculture Development;;;China;;;Eastern Asia;;;Unknown;;;;;;;500.0
279;Lao PDR;;Vietnam-Laos Rubber Joint Stock Company (VLRC);Vietnam Rubber Group;;Lao PDR;Vietnam;;;South-East Asia;;Private;Government;;Rubber;;;;10000.0
288;Lao PDR;;Unknown (Xaysomboun Agriculture Development Co.);Xaysomboun Agriculture Development Co.;;Lao PDR;Malaysia;;;South-East Asia;;Private;Unknown;;Jatropha;;;;1000.0
296;Lao PDR;;Yunnan State Farms Group Co., Ltd.;;;China;;;Eastern Asia;;;Government;;;Rubber;;;;166667.0
297;Lao PDR;;Zhongxing Telephone Equipment (ZTE)/Dynasty Co Ltd;ZTE;;Lao PDR;China;;;Eastern Asia;;Private;Private;;Cassava;;;;100000.0
307;Malaysia;South-East Asia;Sabah Forest Industries (SFI) Sdn Bhd;Avantha Group;;Malaysia;India;;South-East Asia;Southern Asia;;Private;Private;;Eucalyptus;;;;288623.0
308;Malaysia;South-East Asia;KS Oils (Malaysia) Sdn. Bhd.;KS Oils Ltd;;Malaysia;India;;South-East Asia;Southern Asia;;Private;Private;;;;;;405.0
355;Pakistan;Southern Asia;Al Dahra Holding LLC;;;United Arab Emirates;;;Western Asia;;;Private;;;Rice;;;;1295.0
427;Philippines;South-East Asia;Philippine Fuhua Sterling Agricultural Technology Development Corporation;Jilin Fuhua Agricultural Science and Technology Development Co. Ltd.;;Philippines;China;;South-East Asia;Eastern Asia;;Private;Private;;Corn;Maize;;;350.0
450;Philippines;South-East Asia;Taganito HPAL Nickel Corporation (THPAL);Sumitomo Co.;Sumitomo Metal Mining Co., Ltd.;Philippines;Japan;Japan;South-East Asia;Eastern Asia;Eastern Asia;Private;Private;Private;;;;;4862.71
544;Vietnam;South-East Asia;InnovGreen;Sinar Mas Group;;Vietnam;Indonesia;;South-East Asia;South-East Asia;;Private;Private;;Eucalyptus;;;;63000.0
614;India;Southern Asia;Clenergen India Private Limited;Clenergen Corporation;;India;United States of America;;Southern Asia;;;Private;Private;;Bamboo;;;;3642.0
644;India;Southern Asia;Nandan Bio Energy Pte Ltd. (subsumed);Nandan Cleantec PLC;;India;United Kingdom of Great Britain and Northern Ireland;;Southern Asia;;;Private;Private;;Jatropha;;;;40800.0
661;India;Southern Asia;Brandix India Apparel City Private Limited (BIAC);Brandix Lanka Limited;;India;Sri Lanka;;Southern Asia;Southern Asia;;Private;Private;;;;;;405.0
667;India;Southern Asia;Anrak Aluminium Ltd.;Penna Cement Industries Ltd (PCIL);;India;India;;Southern Asia;Southern Asia;;Private;Private;;;;;;755.0
710;Argentina;South America;Hidden Lake S.A.;Joseph Lewis;;Argentina;United Kingdom of Great Britain and Northern Ireland;;South America;;;Private;Private;;;;;;15000.0
717;Argentina;South America;Burco Argentina SA.;Grupo Burco;;Argentina;Belgium;;South America;Western Europe;;Private;Private;;;;;;24394.0
724;Argentina;South America;AgerAustral S.A;AgroGeneration;;Ukraine;France;;Eastern Europe;Western Europe;;Private;Private;;;;;;14000.0
727;Argentina;South America;Nieves de Mendoza SA.;Walbrook;;Argentina;Malaysia;;South America;South-East Asia;;Private;Private;;;;;;468000.0
729;Argentina;South America;Sojitz Buenas Tierras del Sur SA.;Sojitz Group;;Argentina;Japan;;South America;Eastern Asia;;Private;Private;;Wheat;Corn;Maize;;11000.0
734;Argentina;South America;La Primavera Argentina LLC.;Ted Turner;;Argentina;United States of America;;South America;;;Private;Private;;;;;;37000.0
736;Argentina;South America;Bema Agri BV Sucursal Argentina;Bema Agri BV;;Argentina;Netherlands;;South America;Western Europe;;Private;Private;;Sorghum;;;;10000.0
737;Argentina;South America;Grupo MP Wines;M. P. Wines;;Argentina;Netherlands;;South America;Western Europe;;Private;Private;;;;;;1775.0
738;Bolivia;South America;Agropecuaria Acres del Sud SA;Cresud S.A.;;Bolivia;Argentina;;South America;South America;;Private;Private;;;;;;3109.0
739;Bolivia;South America;El Tejar in Bolivia (Plurinational State of);El Tejar Ltd.;;Bolivia;Argentina;;South America;South America;;Private;Private;;;;;;5700.0
744;Bolivia;South America;EverChina Int’l Holdings Company Limited;;;China, Hong Kong Special Administrative Region;;;;;;Private;;;Corn;Maize;Sorghum;;18730.0
747;Brazil;South America;Macquarie Crop Partners;Maquarie Group Ltda;;Brazil;Australia;;South America;Oceania;;Private;Private;;Wheat;Corn;Maize;;10000.0
749;Brazil;South America;"BrasilAgro—Companhia Brasileira de Propiedades Agrícolas (""BrasilAgro"")";Cresud S.A.;;Brazil;Argentina;;South America;South America;;Private;Private;;;;;;24212.0
754;Brazil;South America;Louis Dreyfus Company Brasil S.A.;Louis Dreyfus Group;;Brazil;Netherlands;;South America;Western Europe;;Private;Private;;;;;;30000.0
766;Brazil;South America;Azenglever Agropecuaria Ltda.;Stora Enso;;Brazil;Finland;;South America;Northern Europe;;Private;Private;;Eucalyptus;;;;45700.0
767;Brazil;South America;Veracel Celulose S.A.;Stora Enso;;Brazil;Finland;;South America;Northern Europe;;Private;Private;;Eucalyptus;;;;221086.0
768;Brazil;South America;Raizen;Royal Dutch Shell;;Brazil;Netherlands;;South America;Western Europe;;Private;Private;;;;;;1300000.0
774;Brazil;South America;Renuka do Brasil SA;Shree Renuka Sugars;;Brazil;India;;South America;Southern Asia;;Private;Private;;;;;;78000.0
775;Brazil;South America;Macquarie Crop Partners;Maquarie Group Ltda;;Brazil;Australia;;South America;Oceania;;Private;Private;;;;;;27807.0
776;Brazil;South America;"BrasilAgro—Companhia Brasileira de Propiedades Agrícolas (""BrasilAgro"")";Cresud S.A.;;Brazil;Argentina;;South America;South America;;Private;Private;;;;;;1380.0
778;Brazil;South America;Archer Daniels Midland Company (ADM);;;United States of America;;;;;;Private;;;;;;;5500.0
779;Brazil;South America;Adecoagro Brasil Participações;Adecoagro S.A.;;Brazil;Luxembourg;;South America;Western Europe;;Private;Private;;;;;;13281.0
781;Brazil;South America;Biogreen Oil;Biogreen Oil B.V.;;Brazil;Netherlands;;South America;Western Europe;;Private;Private;;Jatropha;;;;4400.0
783;Brazil;South America;Floresteca SA;Floresteca Holding N.V.;;Brazil;Netherlands;;South America;Western Europe;;Private;Private;;Teak;;;;109000.0
784;Brazil;South America;RDF Empreendimentos Imobiliários Ltda;FIAM N.V. - Forestry Investment and Asset Management N.V;;Brazil;Netherlands;;South America;Western Europe;;Private;Finance;;;;;;36718.0
785;Brazil;South America;Forest Returns in Brazil;Forest Returns;;Brazil;Netherlands;;South America;Western Europe;;Private;Private;;;;;;7000.0
794;Chile;South America;Agronoble;Aceites Borges;;Chile;Spain;;South America;Southern Europe;;Private;Private;;;;;;800.0
795;Chile;South America;Miguel Torres Chile;Grupo Torres;;Chile;Spain;;South America;Southern Europe;;Private;Private;;;;;;406.0
801;Colombia;South America;Bioagroindustrial de Colombia Ltda;Carlos Murgas Guerrero;;Colombia;Colombia;;South America;South America;;Private;Private;;;;;;1814.0
815;Costa Rica;Central America;Forest Returns in Costa Rica;Forest Returns;;Costa Rica;Netherlands;;Central America;Western Europe;;Private;Private;;Teak;;;;1114.0
818;Cuba;Caribbean;Suntime International;;;Cuba;;;Caribbean;;;Private;;;Rice;;;;5000.0
833;Guatemala;Central America;Biocombustibles de Guatemala SA;Bionor Tranformación SA;;Guatemala;Spain;;Central America;Southern Europe;;Private;Private;;Jatropha;;;;473.0
840;Guatemala;Central America;Palmas del Ixcán, S.A.;Arriola Fuxet Family Group;;Guatemala;Guatemala;;Central America;Central America;;Private;Private;;;;;;7500.0
843;Guatemala;Central America;Chabil Utzaj;Grupo Pellas;;Guatemala;Nicaragua;;Central America;Central America;;Private;Private;;;;;;5000.0
844;Guatemala;Central America;Agrocaribe SA;AgroAmerica;;Guatemala;Guatemala;;Central America;Central America;;Private;Private;;;;;;15318.0
847;Guyana;South America;Vaitarna Holdings Private Inc. (VHPI);Cafe Coffee Day (CCD);;Guyana;India;;South America;Southern Asia;;Private;Private;;;;;;391853.0
849;Guyana;South America;Clenergen Guyana Inc. in Guyana;Clenergen Corporation;;Guyana;United States of America;;South America;;;Private;Private;;Bamboo;;;2023;2023.0
851;Guyana;South America;Vaitarna Holdings Private Inc. (VHPI);Cafe Coffee Day (CCD);;Guyana;India;;South America;Southern Asia;;Private;Private;;;;;;345961.0
854;Mexico;Central America;Acciona Energía México;Acciona;;Mexico;Spain;;Central America;Southern Europe;;Private;Private;;;;;;2500.0
855;Mexico;Central America;Iberdrola Renovables México SA;Grupo Iberdrola;;Mexico;Spain;;Central America;Southern Europe;;Private;Private;;;;;;1050.0
859;Mexico;Central America;Global Clean Energy Mexico ILLC;Global Clean Energy Holdings Inc. (GCEH);;Mexico;United States of America;;Central America;;;Private;Private;;Jatropha;;;;6396.0
860;Mexico;Central America;Eolica del Sur;Mitsubishi Corp.;;Mexico;Japan;;Central America;Eastern Asia;;Private;Private;;;;;;1643.0
869;Paraguay;South America;Cresca SA;Carlos Casado;;Paraguay;Argentina;;South America;South America;;Private;Private;;;;;;117307.0
877;Paraguay;South America;CalyxAgro in Paraguay;Louis Dreyfus Group;"TRG Management LP (""TRG,"" d/b/a The Rohatyn Group)";Paraguay;Netherlands;United States of America;South America;Western Europe;;Private;Private;Finance;Corn;Maize;Eucalyptus;;2859.0
879;Paraguay;South America;River Palte SA and BBC SA;River Plate SA;;Paraguay;Brazil;;South America;South America;;Private;Private;;;;;;30783.0
884;Peru;South America;Selva Maestra;Grupo SEM;;Peru;Chile;;South America;South America;;Private;Private;;;;;;12000.0
892;Peru;South America;Camposol S.A;DYER-CORIAT HOLDING, S.L;;Peru;Peru;;South America;South America;;Private;Private;;;;;;3300.0
924;Uruguay;South America;Forestal Oriental S.A;UPM;;Uruguay;Finland;;South America;Northern Europe;;Private;Private;;Eucalyptus;;;;305000.0
928;Uruguay;South America;BTG Pactual;;;Brazil;;;South America;;;Finance;;;Eucalyptus;Pine;;;140000.0
933;Uruguay;South America;Unión Agriculture Group;Union Group (UK) LLP;;Uruguay;United Kingdom of Great Britain and Northern Ireland;;South America;;;Private;Finance;;Wheat;Corn;Maize;;67000.0
934;Uruguay;South America;Campos Orientales in Uruguay;Pergam Finance;;Uruguay;France;;South America;Western Europe;;Private;Finance;;Rice;Corn;Maize;;6561.0
937;Uruguay;South America;Adecoagro  SA in Uruguay;Qatar Investment Authority;;Uruguay;Qatar;;South America;Western Asia;;Private;Government;;Wheat;Barley;;;3177.0
938;Venezuela, RB;;Unknown (Beidahuang, in Venezuela (Bolivarian Republic of), 39837);Beidahuang Kenfeng Seed Co Ltd;;Venezuela, RB;China;;;Eastern Asia;;Private;Government;;Rice;Corn;Maize;;60000.0
962;Lithuania;Northern Europe;Unknown (KTG Agrar);KTG Agrar;;Lithuania;Germany;;Northern Europe;Western Europe;;Private;Private;;Wheat;Rapeseed;Beet;;4650.0
981;Romania;Eastern Europe;Ingleby Romania LLC;INGLEBY FARMS & FORESTS A/S;;Romania;Denmark;;Eastern Europe;Northern Europe;;Private;Private;;Wheat;Corn;Maize;;1105.0
983;Romania;Eastern Europe;Ocolul Silvic Ingleby LLC;INGLEBY FARMS & FORESTS A/S;;Romania;Denmark;;Eastern Europe;Northern Europe;;Private;Private;;;;;;7261.0
984;Romania;Eastern Europe;SC Tornator SRL;Tornator Oyj;;Romania;Finland;;Eastern Europe;Northern Europe;;Private;Private;;;;;;18000.0
1003;Russian Federation;;Dina LLC;Magna Investments Limited;;Russian Federation;United Kingdom of Great Britain and Northern Ireland;;;;;Private;Private;;Wheat;Corn;Maize;;20400.0
1004;Russian Federation;;Dina LLC;Magna Investments Limited;;Russian Federation;United Kingdom of Great Britain and Northern Ireland;;;;;Private;Private;;Wheat;Corn;Maize;;5000.0
1005;Russian Federation;;Agrokultura Kursk LLC;Magna Investments Limited;;Russian Federation;United Kingdom of Great Britain and Northern Ireland;;;;;Private;Private;;Wheat;Corn;Maize;;40000.0
1006;Russian Federation;;Agrokultura Kursk LLC;Magna Investments Limited;;Russian Federation;United Kingdom of Great Britain and Northern Ireland;;;;;Private;Private;;Wheat;Corn;Maize;;13500.0
1007;Russian Federation;;Agrofirm Kolos LLC;Magna Investments Limited;;Russian Federation;United Kingdom of Great Britain and Northern Ireland;;;;;Private;Private;;Wheat;Rapeseed;Barley;;17300.0
1011;Russian Federation;;RAV Agro-Pro LLC;PPF Group N.V.;;Russian Federation;Netherlands;;;Western Europe;;Private;Private;;Wheat;Corn;Maize;;110282.0
1017;Russian Federation;;Bashkir-Agroinvest LLC;AVG Global Ltd;;Russian Federation;Cyprus;;;Western Asia;;Private;Private;;Rice;Wheat;Corn;;124100.0
1019;Solomon Islands;Oceania;Guadalcanal Plains Palm Oil Ltd. (GPPOL);Kulim (Malaysia) Berhad;;Solomon Islands;Malaysia;;Oceania;South-East Asia;;Private;Private;;;;;;7741.0
1021;Suriname;South America;Forest Returns;;;Netherlands;;;Western Europe;;;Private;;;Bamboo;;;;823.0
1023;Ukraine;Eastern Europe;Unknown (Agromino A/S, in Ukraine, 39970);Agromino A/S;;Ukraine;Denmark;;Eastern Europe;Northern Europe;;Private;Private;;Wheat;Corn;Maize;;17181.0
1026;Ukraine;Eastern Europe;Continental Farmers Tobacco Group ('CFTG');Public Investment Fund (PIF) of Saudi Arabia;;Ukraine;Saudi Arabia;;Eastern Europe;Western Asia;;Private;Government;;Wheat;Corn;Maize;;34000.0
1037;Ukraine;Eastern Europe;Astarta Kyiv LLC;Ivanchyk V.P.;;Ukraine;Ukraine;;Eastern Europe;Eastern Europe;;Private;Private;;Wheat;Corn;Maize;;220000.0
1038;Ukraine;Eastern Europe;Greenstone Group;Wintrading Holdings Limited;;Ukraine;British Virgin Islands;;Eastern Europe;;;Private;Private;;Corn;Maize;Rapeseed;;32000.0
1047;Ukraine;Eastern Europe;Zahid-Agro MHP LLC;MHP S.E.;;Ukraine;Cyprus;;Eastern Europe;Western Asia;;Private;Private;;Wheat;Corn;Maize;;40483.0
1051;Ukraine;Eastern Europe;Continental Farmers Group;Public Investment Fund (PIF) of Saudi Arabia;;Ukraine;Saudi Arabia;;Eastern Europe;Western Asia;;Private;Government;;Wheat;Corn;Maize;;123564.0
1062;Argentina;South America;Infinita Renovable;;;Spain;;;Southern Europe;;;Private;;;Rapeseed;;;;50000.0
1063;Argentina;South America;Adecoagro  SA in Argentina;Adecoagro S.A.;;Argentina;Luxembourg;;South America;Western Europe;;Private;Private;;Rice;;;;74000.0
1064;Argentina;South America;Adecoagro  SA in Argentina;Adecoagro S.A.;;Argentina;Luxembourg;;South America;Western Europe;;Private;Private;;Rice;;;;37273.0
1065;Argentina;South America;Adecoagro  SA in Argentina;Adecoagro S.A.;;Argentina;Luxembourg;;South America;Western Europe;;Private;Private;;Wheat;Corn;Maize;;17495.0
1066;Argentina;South America;Adecoagro  SA in Argentina;Adecoagro S.A.;;Argentina;Luxembourg;;South America;Western Europe;;Private;Private;;Rice;;;;10848.0
1067;Argentina;South America;Adecoagro  SA in Argentina;Adecoagro S.A.;;Argentina;Luxembourg;;South America;Western Europe;;Private;Private;;Wheat;Corn;Maize;;15451.0
1084;Peru;South America;Pure Biofuels de Perú SA;Pure Biofuels;;Peru;United States of America;;South America;;;Private;Private;;;;;;60000.0
1086;Peru;South America;Samoa Fiber Holdings Inc.;;;United States of America;;;;;;Private;;;;;;;15000.0
1098;Angola;Sub-Saharan Africa;Companhia de Bioenergia de Angola Lda;Sonangol;;Angola;Angola;;Sub-Saharan Africa;Sub-Saharan Africa;;Private;Government;;;;;;81201.0
1099;Angola;Sub-Saharan Africa;Unknown (Lonrho Plc, in Angola, 39881);Lonrho Plc;;Angola;United Kingdom of Great Britain and Northern Ireland;;Sub-Saharan Africa;;;Private;Private;;Rice;;;;25000.0
1101;Angola;Sub-Saharan Africa;AfriAgro;Atlantica Group;;Angola;Portugal;;Sub-Saharan Africa;Southern Europe;;Private;Private;;;;;;5000.0
1103;Angola;Sub-Saharan Africa;Quifel Agribusiness Ltd in Angola;Quifel Holdings;;Angola;Portugal;;Sub-Saharan Africa;Southern Europe;;Private;Private;;Rice;Jatropha;;;10000.0
1113;Benin;Sub-Saharan Africa;Sucobe;China National Complete Plant Import & Export Corporation;;Benin;China;;Sub-Saharan Africa;Eastern Asia;;Private;Private;;;;;;5200.0
1141;Cameroon;Sub-Saharan Africa;SOSUCAM;Government of Cameroon;;Cameroon;Cameroon;;Sub-Saharan Africa;Sub-Saharan Africa;;Private;Government;;;;;;11980.0
