Deal Number;Target Country;Target Region;Investor 1;Investor 2;Investor 3;Investor Country 1;Investor Country 2;Investor Country 3;Investor Region 1;Investor Region 2;Investor Region 3;Inv. Sector 1;Inv. Sector 2;Inv. Sector 3;Crop 1;Crop 2;Crop 3;Year;Hectares
3628;Uruguay;South America;NZ Farming Systems Uruguay;Temasek Holdings;;Uruguay;Singapore;;South America;South-East Asia;;Private;Finance;;;;;;1019.0
3629;Uruguay;South America;NZ Farming Systems Uruguay;Temasek Holdings;;Uruguay;Singapore;;South America;South-East Asia;;Private;Finance;;;;;;944.0
3631;Uruguay;South America;NZ Farming Systems Uruguay;Temasek Holdings;;Uruguay;Singapore;;South America;South-East Asia;;Private;Finance;;;;;;1002.0
3632;Uruguay;South America;NZ Farming Systems Uruguay;Temasek Holdings;;Uruguay;Singapore;;South America;South-East Asia;;Private;Finance;;;;;2085;2085.0
3633;Uruguay;South America;NZ Farming Systems Uruguay;Temasek Holdings;;Uruguay;Singapore;;South America;South-East Asia;;Private;Finance;;;;;;650.0
3634;Uruguay;South America;NZ Farming Systems Uruguay;Temasek Holdings;;Uruguay;Singapore;;South America;South-East Asia;;Private;Finance;;;;;;1796.0
3639;Indonesia;South-East Asia;PT Sarana Prima Multi Niaga;TSH Resources Berhad;;Indonesia;Malaysia;;South-East Asia;South-East Asia;;Private;Private;;;;;;7114.0
3640;Indonesia;South-East Asia;PT Farinda Bersaudara;TSH Resources Berhad;;Indonesia;Malaysia;;South-East Asia;South-East Asia;;Private;Private;;;;;;12628.0
3641;Indonesia;South-East Asia;PT Laras Internusa;TSH Resources Berhad;;Indonesia;Malaysia;;South-East Asia;South-East Asia;;Private;Private;;;;;;7309.0
3642;Indonesia;South-East Asia;PT Teguh Swakarsa Sejahtera;TSH Resources Berhad;;Indonesia;Malaysia;;South-East Asia;South-East Asia;;Private;Private;;;;;;10282.0
3644;Indonesia;South-East Asia;PT Bulungan Citra Agro Persada;TSH Resources Berhad;;Indonesia;Malaysia;;South-East Asia;South-East Asia;;Private;Private;;;;;;13215.0
3646;Indonesia;South-East Asia;PT Munte Waniq Jaya Perkasa;TSH Resources Berhad;;Indonesia;Malaysia;;South-East Asia;South-East Asia;;Private;Private;;;;;;8016.0
3648;Uruguay;South America;NZ Farming Systems Uruguay;Temasek Holdings;;Uruguay;Singapore;;South America;South-East Asia;;Private;Finance;;;;;;3396.0
3649;Uruguay;South America;NZ Farming Systems Uruguay;Temasek Holdings;;Uruguay;Singapore;;South America;South-East Asia;;Private;Finance;;;;;;4003.0
3650;Uruguay;South America;NZ Farming Systems Uruguay;Temasek Holdings;;Uruguay;Singapore;;South America;South-East Asia;;Private;Finance;;;;;;691.0
3651;Uruguay;South America;NZ Farming Systems Uruguay;Temasek Holdings;;Uruguay;Singapore;;South America;South-East Asia;;Private;Finance;;Corn;Maize;Sorghum;;6530.0
3652;Papua New Guinea;Oceania;Pomata Investment Ltd;Rimbunan Hijau Group (RH Group);;Papua New Guinea;Malaysia;;Oceania;South-East Asia;;Private;Private;;;;;;15000.0
3653;Papua New Guinea;Oceania;Nakiura Investment Ltd;Rimbunan Hijau Group (RH Group);;Papua New Guinea;Malaysia;;Oceania;South-East Asia;;Private;Private;;;;;;16100.0
3654;Papua New Guinea;Oceania;Ralopal Investment Ltd;Rimbunan Hijau Group (RH Group);;Papua New Guinea;Malaysia;;Oceania;South-East Asia;;Private;Private;;;;;;11300.0
3655;Papua New Guinea;Oceania;Bewani Oil Palm Development Ltd;Prosper Group of Companies (PGC);;Papua New Guinea;Malaysia;;Oceania;South-East Asia;;Private;Private;;;;;;139909.0
3657;Papua New Guinea;Oceania;Gilford Limitted;Rimbunan Hijau Group (RH Group);;Papua New Guinea;Malaysia;;Oceania;South-East Asia;;Private;Private;;Coconut;;;;42400.0
3659;Papua New Guinea;Oceania;Polopo Limited;Rimbunan Hijau Group (RH Group);;Papua New Guinea;Malaysia;;Oceania;South-East Asia;;Private;Private;;;;;;8328.0
3660;Indonesia;South-East Asia;PT Gunung Sawit Selatan Lestari;Boon Siew Sdn Bhd;;Indonesia;Malaysia;;South-East Asia;South-East Asia;;Private;Private;;;;;;2680.0
3661;Indonesia;South-East Asia;PT Pratama Palm Abadi;Boon Siew Sdn Bhd;;Indonesia;Malaysia;;South-East Asia;South-East Asia;;Private;Private;;;;;;3193.0
3662;Indonesia;South-East Asia;PT Dapo Agro Makmur;Boon Siew Sdn Bhd;;Indonesia;Malaysia;;South-East Asia;South-East Asia;;Private;Private;;;;;;2680.0
3663;Indonesia;South-East Asia;PT Graha Inti Jaya;Tianjin Julong Group Co Ltd;;Indonesia;China;;South-East Asia;Eastern Asia;;Private;Private;;;;;;24000.0
3664;Papua New Guinea;Oceania;East Waii Oil Palm Limted;River Estates Plantations Limited;;Papua New Guinea;Malaysia;;Oceania;South-East Asia;;Private;Private;;;;;;21108.0
3668;Nicaragua;Central America;Norteak Maderas SA;Norteak;Hemco Nicaragua, S.A.;Nicaragua;Norway;Nicaragua;Central America;Northern Europe;Central America;Private;Private;Private;Teak;;;;7500.0
3679;Papua New Guinea;Oceania;Nuku Resources Ltd;Skywalker Global Resources Company Limited (Skywalker HK);;Papua New Guinea;China, Hong Kong Special Administrative Region;;Oceania;;;Private;Private;;Coffee;Rubber;Jatropha;;239810.0
3680;Papua New Guinea;Oceania;PISA American Lumber Joint Venture Ltd.;Independent Timbers and Stevedoring (IT&S);;Papua New Guinea;United States of America;;Oceania;;;Private;Private;;;;;;790800.0
3681;Papua New Guinea;Oceania;La-Ali Investments Limited;Rimbunan Hijau Group (RH Group);;Papua New Guinea;Malaysia;;Oceania;South-East Asia;;Private;Private;;;;;;7170.0
3683;Papua New Guinea;Oceania;Haubawe Holdings Limited;Rimbunan Hijau Group (RH Group);;Papua New Guinea;Malaysia;;Oceania;South-East Asia;;Private;Private;;;;;;11110.0
3687;Papua New Guinea;Oceania;Gilford Limitted;Rimbunan Hijau Group (RH Group);;Papua New Guinea;Malaysia;;Oceania;South-East Asia;;Private;Private;;;;;;13000.0
3706;Papua New Guinea;Oceania;Toriu Timbers Limited;KK Conections Limited;;Papua New Guinea;Malaysia;;Oceania;South-East Asia;;Private;Private;;Coconut;;;;42240.0
3707;Papua New Guinea;Oceania;West Maimai Investment Limited, Yangkok Resources Limited, Palai Resources Limited;Gold World Resources Company (PNG) Ltd;;Papua New Guinea;China, Hong Kong Special Administrative Region;;Oceania;;;Private;Private;;Rubber;Jatropha;;;149000.0
3708;Papua New Guinea;Oceania;North East West Investments (NEWIL);Independent Timbers and Stevedoring (IT&S);;Papua New Guinea;United States of America;;Oceania;;;Private;Private;;;;;;619759.0
3709;Papua New Guinea;Oceania;Wammy Limited;Global Elite Limited;;Papua New Guinea;Malaysia;;Oceania;South-East Asia;;Private;Private;;Rubber;;;;105200.0
3711;Papua New Guinea;Oceania;Urasir Resources Limited;Continental Venture Limited;;Papua New Guinea;Malaysia;;Oceania;South-East Asia;;Private;Private;;Rubber;;;;112400.0
3712;Indonesia;South-East Asia;PT Toton Usaha Mandiri;Société Internationale de Plantations et de Finance (SIPEF);;Indonesia;Belgium;;South-East Asia;Western Europe;;Private;Private;;;;;;1199.0
3716;Papua New Guinea;Oceania;Koaru Resource Owners Company;Pacific International Resources PNG Limited;;Papua New Guinea;Malaysia;;Oceania;South-East Asia;;Private;Private;;Pine;;;;59460.0
3718;Indonesia;South-East Asia;PT Agro Rawas Ulu;Société Internationale de Plantations et de Finance (SIPEF);;Indonesia;Belgium;;South-East Asia;Western Europe;;Private;Private;;;;;;9000.0
3719;Papua New Guinea;Oceania;Ang Agro Forest Management Ltd;Kuala Lumpur Kepong Berhad (KLK);;Papua New Guinea;Malaysia;;Oceania;South-East Asia;;Private;Private;;;;;;5992.0
3726;Philippines;South-East Asia;Bronzeoak Philippines Inc.;Bronzeoak Group;;Philippines;United Kingdom of Great Britain and Northern Ireland;;South-East Asia;;;Private;Private;;;;;;9000.0
3727;Uruguay;South America;Campos Orientales in Uruguay;Pergam Finance;;Uruguay;France;;South America;Western Europe;;Private;Finance;;Rice;Corn;Maize;;6939.0
3728;Uruguay;South America;Campos Orientales in Uruguay;Pergam Finance;;Uruguay;France;;South America;Western Europe;;Private;Finance;;Wheat;Corn;Maize;;6261.0
3729;Uruguay;South America;Campos Orientales in Uruguay;Pergam Finance;;Uruguay;France;;South America;Western Europe;;Private;Finance;;Wheat;Corn;Maize;;3504.0
3747;Congo, Dem. Rep.;;Brabanta S.P.R.L.;Bolloré Group;;Congo, Dem. Rep.;France;;;Western Europe;;Private;Private;;;;;;8380.0
3748;Nicaragua;Central America;Camarones de Nicaragua;Grupo Pescanova;;Nicaragua;Spain;;Central America;Southern Europe;;Private;Private;;;;;;4500.0
3750;Ethiopia;Sub-Saharan Africa;Unknown (Ali Saif Mohammed Saif Al Ghafli);Ali Saif Mohammed Saif Al Ghafli;;Ethiopia;United Arab Emirates;;Sub-Saharan Africa;Western Asia;;Private;Unknown;;;;;;600.0
3751;Ethiopia;Sub-Saharan Africa;Unknown (Berekat Jovain Agricultural Company Private JointStock);Berekat Jovain Agricultural Company Private JointStock;;Ethiopia;Iran, Islamic Rep.;;Sub-Saharan Africa;;;Private;Unknown;;Wheat;Corn;Maize;2000;2000.0
3753;Ethiopia;Sub-Saharan Africa;Unknown (Unnamed investor 163, Zeyoge's Agriculture and Industry PLC);Unnamed investor 163;;Ethiopia;Ethiopia;;Sub-Saharan Africa;Sub-Saharan Africa;;Private;Unknown;;Corn;Maize;;;300.0
3754;Nicaragua;Central America;Maderas Cultivadas de Centroamerica;Grupo Los Nacientes;;Nicaragua;Costa Rica;;Central America;Central America;;Private;Private;;;;;;3200.0
3761;Ghana;Sub-Saharan Africa;Mim cashew;Mim cashew & Agricultural Products Ltd.;;Ghana;Denmark;;Sub-Saharan Africa;Northern Europe;;Private;Private;;Corn;Maize;Jatropha;;761.0
3764;Ghana;Sub-Saharan Africa;Brazil Agro-Business Group (Ghana);Brazil Agro-Business Group;;Ghana;Brazil;;Sub-Saharan Africa;South America;;Private;Private;;Rice;;;;2220.0
3765;Ghana;Sub-Saharan Africa;Golden Exotics Limited (GEL);Compagnie fruitière;;Ghana;France;;Sub-Saharan Africa;Western Europe;;Private;Private;;Banana;Pineapple;;;3500.0
3766;Ghana;Sub-Saharan Africa;Symboil Ghana Ltd;Symboil AG;;Ghana;Germany;;Sub-Saharan Africa;Western Europe;;Private;Private;;Corn;Maize;Jatropha;;7000.0
3767;Ghana;Sub-Saharan Africa;DOS Palm Oil Production (Ghana Ltd);DOS Palm Oil Production Limited (UK);;Ghana;United Kingdom of Great Britain and Northern Ireland;;Sub-Saharan Africa;;;Private;Private;;;;;;700.0
3768;Ghana;Sub-Saharan Africa;Global Agri-development Company Ghana Limited;RMG Concept Limited;;Ghana;Switzerland;;Sub-Saharan Africa;Western Europe;;Private;Finance;;Rice;;;;2500.0
3770;Ghana;Sub-Saharan Africa;Volta Red Farms Ltd (VRL);Volta Red;;Ghana;United Kingdom of Great Britain and Northern Ireland;;Sub-Saharan Africa;;;Private;Private;;;;;;3715.0
3773;Ghana;Sub-Saharan Africa;Norpalm Ghana Ltd.;Norpalm AS;;Ghana;Norway;;Sub-Saharan Africa;Northern Europe;;Private;Private;;;;;;4652.65
3774;Kenya;Sub-Saharan Africa;Kwale International Sugar Company (KISCOL);Omnicane Holdings Ltd;;Kenya;Mauritius;;Sub-Saharan Africa;Sub-Saharan Africa;;Private;Private;;;;;;6070.0
3778;Ghana;Sub-Saharan Africa;Unknown (VP Group);VP Group;;Ghana;Kenya;;Sub-Saharan Africa;Sub-Saharan Africa;;Private;Unknown;;;;;;1070.0
3781;Ghana;Sub-Saharan Africa;Afram Plantation Ltd;Global Environment Fund (GEF);;Ghana;United States of America;;Sub-Saharan Africa;;;Private;Finance;;Rice;Corn;Maize;;136860.0
3783;Zambia;Sub-Saharan Africa;Amatheon Agri Zambia Limited;Amatheon Agri Holding N.V.;;Zambia;Germany;;Sub-Saharan Africa;Western Europe;;Private;Private;;Rice;Wheat;Corn;;38760.0
3785;Congo, Dem. Rep.;;Wildlife Works Carbon LLC;NatureBank Asset Management Inc.;;United States of America;Canada;;;Northern America;;Private;Private;;Cassava;;;;299640.0
3786;Zimbabwe;Sub-Saharan Africa;Ariston Holdings Ltd.;Afrifresh;;Zimbabwe;South Africa;;Sub-Saharan Africa;Sub-Saharan Africa;;Private;Private;;Corn;Maize;Tea;;7864.0
3787;Myanmar;South-East Asia;Dawei Development Company Limited;Italian-Thai Development Public Company Limited;;Myanmar;Thailand;;South-East Asia;South-East Asia;;Private;Private;;;;;;19600.0
3796;Colombia;South America;Compañía Agrícola de la Sierra Colombia S.A.;Comaco;;Colombia;Chile;;South America;South America;;Private;Private;;Pine;;;;23436.0
3799;Myanmar;South-East Asia;Unknown (Yunnan United Development Corporation);State Power Investment Corporation Limited;;Myanmar;China;;South-East Asia;Eastern Asia;;Private;Government;;;;;;12060.0
3815;Ethiopia;Sub-Saharan Africa;Al-Mehdi Match Makers Plc;Al-Mehdi Group;;Ethiopia;Pakistan;;Sub-Saharan Africa;Southern Asia;;Private;Private;;;;;;1000.0
3819;Ethiopia;Sub-Saharan Africa;BGI Ethiopia;Castel Winery Plc;;Ethiopia;France;;Sub-Saharan Africa;Western Europe;;Private;Private;;;;;;450.0
3824;Ethiopia;Sub-Saharan Africa;Unknown (Green Valley Agro Plc, in Ethiopia, 37614);Green Valley Agro Plc;;Ethiopia;India;;Sub-Saharan Africa;Southern Asia;;Private;Private;;Cotton;;;;5000.0
3832;Ethiopia;Sub-Saharan Africa;AYCOOM Agricultural Development Plc;Omo Valley Farm Cooperation Plc;;Ethiopia;Ethiopia;;Sub-Saharan Africa;Sub-Saharan Africa;;Private;Private;;Cotton;;;;10000.0
3841;Ethiopia;Sub-Saharan Africa;Saudi Star Agricultural Development Plc;Saudi Star Agricultural Development Plc;;Ethiopia;Saudi Arabia;;Sub-Saharan Africa;Western Asia;;Private;Private;;Rice;Beet;;;10000.0
3842;Tanzania;Sub-Saharan Africa;Unknown (Boleyn International, in United Republic of Tanzania, 37632);Boleyn International;;Tanzania;China;;Sub-Saharan Africa;Eastern Asia;;Private;Private;;Eucalyptus;;;;344.0
3844;Cameroon;Sub-Saharan Africa;Sud-Cameroun Hevea S.A.;SPPH;;Cameroon;France;;Sub-Saharan Africa;Western Europe;;Private;Private;;Rubber;;;;45198.0
3846;Indonesia;South-East Asia;PT Bilah Plantindo;M.P. Evans Group PLC;;Indonesia;United Kingdom of Great Britain and Northern Ireland;;South-East Asia;;;Private;Private;;;;;;2956.0
3848;Mozambique;Sub-Saharan Africa;Wanbao Africa agriculture Development Limitada  (WAADL);Três Fontes Investment Limited;;Mozambique;Mauritius;;Sub-Saharan Africa;Sub-Saharan Africa;;Private;Private;;Rice;Corn;Maize;;20000.0
3849;Guinea;Sub-Saharan Africa;Guinee Energia S.A.;Nuove Iniziative Industriali srl;;Guinea;Italy;;Sub-Saharan Africa;Southern Europe;;Private;Private;;Jatropha;Tobacco;;;74504.0
3854;Gambia, The;;Unknown (Ovidiu Tender, in Gambia, 39901);Ovidiu Tender;;Gambia, The;Romania;;;Eastern Europe;;Private;Private;;Jatropha;;;;30000.0
3855;Senegal;Sub-Saharan Africa;Unknown (Ovidiu Tender, in Senegal, 39900);Ovidiu Tender;;Senegal;Romania;;Sub-Saharan Africa;Eastern Europe;;Private;Private;;Jatropha;;;;100000.0
3858;Sri Lanka;Southern Asia;Alpha and Omega Developers (Pvt) Ltd.;Vasudewan Rasaiya;;Sri Lanka;United States of America;;Southern Asia;;;Private;Private;;;;;;254.0
3865;Congo, Dem. Rep.;;Nocafex SPRL;Nocafex;;Congo, Dem. Rep.;Belgium;;;Western Europe;;Private;Unknown;;Coffee;Rubber;;;37800.0
3867;Congo, Dem. Rep.;;Congo  BioFuels (CBF);Hawkwood Capital LLC;;Congo, Dem. Rep.;United Kingdom of Great Britain and Northern Ireland;;;;;Private;Finance;;Rubber;Eucalyptus;;;5244.0
3868;Indonesia;South-East Asia;Bumitama Agri Ltd;IOI Group;;Singapore;Malaysia;;South-East Asia;South-East Asia;;Private;Private;;;;;;187917.0
3869;Indonesia;South-East Asia;Unknown (Kencana Agri Limited, in Indonesia, 37670);Kencana Agri Limited;;Indonesia;Singapore;;South-East Asia;South-East Asia;;Private;Private;;;;;;23000.0
3872;Indonesia;South-East Asia;Unknown (Kencana Agri Limited, in Indonesia, 37673);Kencana Agri Limited;;Indonesia;Singapore;;South-East Asia;South-East Asia;;Private;Private;;;;;;46000.0
3873;Indonesia;South-East Asia;PT Sawit Kaltim Lestari;;;Indonesia;;;South-East Asia;;;Private;;;;;;;12000.0
3878;Argentina;South America;Los Yaros Agropecuaria S.A.;DWS GALOF;;Argentina;Singapore;;South America;South-East Asia;;Private;Finance;;;;;;30000.0
3880;Tanzania;Sub-Saharan Africa;Euro Vistaa (Tanzania) Ltd;Eurovistaa Trading Co. Ltd;;Tanzania;India;;Sub-Saharan Africa;Southern Asia;;Private;Unknown;;Corn;Maize;Cotton;;1301.0
3881;Tanzania;Sub-Saharan Africa;FJS African Starch Development Co. Ltd.;Scheer Foundation;;Tanzania;United States of America;;Sub-Saharan Africa;;;Private;Private;;Cassava;;;;5000.0
3885;Tanzania;Sub-Saharan Africa;NB Tanagro Limited;Nava Bharat Ventures Limited;;Tanzania;India;;Sub-Saharan Africa;Southern Asia;;Private;Private;;;;;;6000.0
3886;Tanzania;Sub-Saharan Africa;Rufiji Sugar Plant Limited;Mahakaushal Sugar and Power Industries Ltd;;Tanzania;India;;Sub-Saharan Africa;Southern Asia;;Private;Unknown;;;;;;12132.0
3888;Tanzania;Sub-Saharan Africa;Syngen Fuels and Agri Products;SyEnergy Agriproduction;;Tanzania;India;;Sub-Saharan Africa;Southern Asia;;Private;Unknown;;Rice;;;;30000.0
3891;Colombia;South America;Unknown_Riopaila_Castilla;Riopaila Castilla S.A;;Colombia;Colombia;;South America;South America;;Private;Private;;Corn;Maize;Eucalyptus;;35642.0
3893;Mozambique;Sub-Saharan Africa;Portucel Moçambique Lda;World Bank;;Mozambique;United States of America;;Sub-Saharan Africa;;;Private;Finance;;Eucalyptus;;;;182886.0
3907;Lao PDR;;Outspan Bolovens Limited (OBL);Temasek Holdings;;Lao PDR;Singapore;;;South-East Asia;;Private;Finance;;Coffee;;;;3000.0
3908;Lao PDR;;Lao-Indochina Group Public Company Limited;Indo-China Group;;Lao PDR;China;;;Eastern Asia;;Private;Unknown;;Cassava;;;;7689.0
3911;Lao PDR;;Dau Tieng - Viet Lao Rubber Joint Stock Company;Vietnam Rubber Group;;Lao PDR;Vietnam;;;South-East Asia;;Private;Government;;Rubber;;;;10000.0
3915;Ghana;Sub-Saharan Africa;Formaco Company Ltd;Formako Farms;;Ghana;United Kingdom of Great Britain and Northern Ireland;;Sub-Saharan Africa;;;Private;Unknown;;Corn;Maize;Pineapple;;405.0
3918;Guinea;Sub-Saharan Africa;Unknown (Agro Energy Développement, in Guinea, 39897);Agro Energy Développement;;Guinea;France;;Sub-Saharan Africa;Western Europe;;Private;Unknown;;Jatropha;;;;100000.0
3920;Indonesia;South-East Asia;PT Temila Agro Abadi;Government of Malaysia;;Indonesia;Malaysia;;South-East Asia;South-East Asia;;Private;Government;;;;;;8193.0
3924;Mozambique;Sub-Saharan Africa;Unknown (Development Agroindustrial Investment Spa, CASIS (Company Agro Social Igo Sammartini));Development Agroindustrial Investment Spa;;Mozambique;Italy;;Sub-Saharan Africa;Southern Europe;;Private;Unknown;;Rice;Wheat;Corn;;3000.0
3925;Ethiopia;Sub-Saharan Africa;Lim Siow Jin Estate Sdn. Bhd. (Ethiopia Branch);Lim Siow Jin Estate;;Ethiopia;Malaysia;;Sub-Saharan Africa;South-East Asia;;Private;Unknown;;Corn;Maize;Rubber;;31000.0
3927;Honduras;Central America;AZUNOSA;SabMiller;;Honduras;United Kingdom of Great Britain and Northern Ireland;;Central America;;;Private;Private;;;;;;4264.0
3928;Paraguay;South America;Fundación Paz Global;;;Republic of Korea;;;;;;Private;;;;;;;240000.0
3942;Argentina;South America;Fondomonte South America SA;Almarai Co.;;Argentina;Saudi Arabia;;South America;Western Asia;;Private;Private;;Corn;Maize;;;3695.0
3948;Jamaica;Caribbean;Pan Caribbean Sugar Company Ltda.;China National Complete Plant Import & Export Corporation;;Jamaica;China;;Caribbean;Eastern Asia;;Private;Private;;;;;;18000.0
3952;Lao PDR;;Viet Nam-Laos Coffee Joint Stock Co.;Viet Nam National Coffee Corp. (Vinacafe);;Lao PDR;Vietnam;;;South-East Asia;;Private;Government;;Coffee;;;;1000.0
3973;Lao PDR;;Hoang Anh – Quang Minh Rubber Industrial and Agricultural JSC;Vietnam Rubber Group;;Lao PDR;Vietnam;;;South-East Asia;;Private;Government;;Rubber;;;;4897.54
3980;Mozambique;Sub-Saharan Africa;Olam Algodao do Valo do Zambeze;Temasek Holdings;;Mozambique;Singapore;;Sub-Saharan Africa;South-East Asia;;Private;Finance;;Cotton;;;;1500.0
3982;Lao PDR;;Xeunva Trading & Rubber Plantation Co. Ltd.;Xeunhua Commerce Company, Ltd.;;Lao PDR;China;;;Eastern Asia;;Private;Unknown;;Rubber;;;;1025.0
3986;Sudan;Sub-Saharan Africa;Unknown(GLB Invest);GLB Invest;;Sudan;Lebanon;;Sub-Saharan Africa;Western Asia;;Private;Private;;Corn;Maize;Sesame;;87200.0
3989;Lao PDR;;Unknown (Houfuco Company, Ltd.);Houfuco Company, Ltd.;;Lao PDR;Vietnam;;;South-East Asia;;Private;Unknown;;Cassava;;;;284.0
3993;Lao PDR;;China-Lao Ruifeng Rubber Company;Kunming Ruipu Biotechnology Co. Ltd.;;Lao PDR;China;;;Eastern Asia;;Private;Unknown;;Rubber;;;;10000.0
3998;Lao PDR;;Unknown (Shengli Rubber Co);Shengli Rubber Co;;Lao PDR;China;;;Eastern Asia;;Private;Unknown;;Rubber;;;2000;2000.0
4013;Lao PDR;;Sino-Lao Rubber Company;Tongly;;Lao PDR;Lao PDR;;;;;Private;Private;;Rubber;;;;22000.0
4015;Lao PDR;;Unknown (Ying Jiu Pa Company Ltd.);Ying Jiu Pa Company Ltd.;;Lao PDR;China;;;Eastern Asia;;Private;Private;;Rubber;;;;2500.0
4024;Uruguay;South America;CalyxAgro in Uruguay;Louis Dreyfus Group;"TRG Management LP (""TRG,"" d/b/a The Rohatyn Group)";Uruguay;Netherlands;United States of America;South America;Western Europe;;Private;Private;Finance;;;;;1010.0
4025;Uruguay;South America;CalyxAgro in Uruguay;Louis Dreyfus Group;"TRG Management LP (""TRG,"" d/b/a The Rohatyn Group)";Uruguay;Netherlands;United States of America;South America;Western Europe;;Private;Private;Finance;;;;;611.0
4026;Uruguay;South America;CalyxAgro in Uruguay;Louis Dreyfus Group;"TRG Management LP (""TRG,"" d/b/a The Rohatyn Group)";Uruguay;Netherlands;United States of America;South America;Western Europe;;Private;Private;Finance;Wheat;;;;708.0
4027;Uruguay;South America;CalyxAgro in Uruguay;Louis Dreyfus Group;"TRG Management LP (""TRG,"" d/b/a The Rohatyn Group)";Uruguay;Netherlands;United States of America;South America;Western Europe;;Private;Private;Finance;Wheat;;;;1659.0
4029;Lao PDR;;Yupaoyan Cassava Processing Co., Ltd.;Flour Lao China Company;;Lao PDR;China;;;Eastern Asia;;Private;Private;;Cassava;;;;214.0
4030;Lao PDR;;Unknown (Yunnan Rubber Company Ltd.);Yunnan Rubber Company Ltd.;;Lao PDR;China;;;Eastern Asia;;Private;Government;;Rubber;;;;3000.0
4044;Colombia;South America;Unknown (La Esperanza Timberland Holding Limited, in Colombia, 37978);La Esperanza Timberland Holding Limited;;Colombia;British Virgin Islands;;South America;;;Private;Private;;;;;;1292.0
4045;Colombia;South America;La Diana Timberland Holdings Limited;;;British Virgin Islands;;;;;;Private;;;;;;;1283.0
4046;Colombia;South America;Unknown (Las Ventas Timberland Holdings Limited, in Colombia, 37983);Las Ventas Timberland Holdings Limited;;Colombia;British Virgin Islands;;South America;;;Private;Private;;;;;;1273.0
4047;Colombia;South America;Potosí Timberland Holdings Limited;;;British Virgin Islands;;;;;;Private;;;;;;;1269.0
4048;Colombia;South America;Unknown (La Libertad Wood Holdings Limited, in Colombia, 37985);La Libertad Wood Holdings Limited;;Colombia;British Virgin Islands;;South America;;;Private;Private;;;;;;1294.0
4049;Colombia;South America;Unknown (La Paz Wood Holding Limited, in Colombia, 37986);La Paz Wood Holding Limited;;Colombia;British Virgin Islands;;South America;;;Private;Private;;;;;;1290.0
4050;Colombia;South America;La Esperanza Wood Holding Limited, in Colombia;La Esperanza Wood Holding Limited;;Colombia;British Virgin Islands;;South America;;;Private;Private;;;;;;1294.0
4051;Colombia;South America;Unknown (Canaguay Wood Holding Limited, in Colombia, 37990);Canaguay Wood Holding Limited;;Colombia;British Virgin Islands;;South America;;;Private;Private;;;;;;1293.0
4052;Colombia;South America;El Morichal Wood Holding Limited;;;British Virgin Islands;;;;;;Private;;;;;;;880.0
4053;Colombia;South America;Unknown (Paraíso Wood Holding Limited, in Colombia, 37993);Paraíso Wood Holding Limited;;Colombia;British Virgin Islands;;South America;;;Private;Private;;;;;;326.0
4055;Senegal;Sub-Saharan Africa;Compangie Agricole de St. Louis;Mr Laurent Nicolas;;Senegal;France;;Sub-Saharan Africa;Western Europe;;Private;Private;;Rice;;;;4500.0
4058;Senegal;Sub-Saharan Africa;Unknown (Hayat);Hayat;;Senegal;Libya;;Sub-Saharan Africa;Northern Africa;;Private;Unknown;;;;;;3150.0
4060;Zambia;Sub-Saharan Africa;CBL Agri Zambia Limited (CBAZ);Crookes Brothers Ltd;;Zambia;South Africa;;Sub-Saharan Africa;Sub-Saharan Africa;;Private;Private;;;;;;440.0
4061;Mozambique;Sub-Saharan Africa;Murrimo Macadamia Lda;Crookes Brothers Ltd;;Mozambique;South Africa;;Sub-Saharan Africa;Sub-Saharan Africa;;Private;Private;;Corn;Maize;;;4030.0
4065;China;Eastern Asia;APRIL SSYMB;Royal Golden Eagle International (RGE);;China;Singapore;;Eastern Asia;South-East Asia;;Private;Private;;Eucalyptus;;;;13000.0
4070;Argentina;South America;Bruno Mauricio Varela Marin;;;Uruguay;;;South America;;;Private;;;;;;;14516.0
4081;Brazil;South America;Fonterra Brasil Fazenda MIH Ltda;Fonterra;;Brazil;New Zealand;;South America;Oceania;;Private;Private;;;;;;855.0
4082;Brazil;South America;SB Agrícola Ltda in Brazil;SB Agrícola Ltda;;Brazil;United States of America;;South America;;;Private;Private;;Wheat;Corn;Maize;;2194.0
4087;Brazil;South America;Familia Garms;;;Brazil;;;South America;;;Private;;;;;;;13089.0
4088;Brazil;South America;Familia Garms;;;Brazil;;;South America;;;Private;;;;;;;11925.0
4089;Brazil;South America;Familia Garms;;;Brazil;;;South America;;;Private;;;Pineapple;;;;6798.0
4090;Brazil;South America;Familia Garms;;;Brazil;;;South America;;;Private;;;;;;;5292.0
4091;Brazil;South America;Familia Garms;;;Brazil;;;South America;;;Private;;;;;;;12777.0
4092;Brazil;South America;Familia Garms;;;Brazil;;;South America;;;Private;;;;;;;7320.0
4094;Brazil;South America;Familia Garms;;;Brazil;;;South America;;;Private;;;;;;;30000.0
4095;Brazil;South America;Familia Garms;;;Brazil;;;South America;;;Private;;;;;;;12920.0
4096;Brazil;South America;Familia Garms;;;Brazil;;;South America;;;Private;;;;;;;17870.0
4102;China;Eastern Asia;Haofeng (Qingdao) Food Co., Ltd;Qingdao Kaifeng Organic Vegetable Development Co., Ltd.;HONGKONG YONGXIN GROUP CO., LIMITED;China;China;China, Hong Kong Special Administrative Region;Eastern Asia;Eastern Asia;;Private;Private;Private;Onion;;;;733.0
4109;Lao PDR;;Unknown (Lilieng Power Co. Ltd.);Lilieng Power Co. Ltd.;;Lao PDR;China;;;Eastern Asia;;Private;Unknown;;Rubber;;;;300.0
